<?xml version="1.0" encoding="UTF-8"?>
<?xml-model href="http://www.tei-c.org/release/xml/tei/custom/schema/relaxng/tei_ms.rng" type="application/xml"
schematypens="http://purl.oclc.org/dsdl/schematron"?>
<TEI xmlns:xsi="http://www.w3.org/2001/XMLSchema-instance"
  xsi:schemaLocation="http://www.tei-c.org/ns/1.0 ../paths-schema.xsd"
  xmlns="http://www.tei-c.org/ns/1.0">
  <teiHeader>
    <fileDesc>
      <titleStmt>
        <title>paths.colophons.25</title>
      </titleStmt>
      <publicationStmt>
        <p>paths.colophons.25</p>
      </publicationStmt>
      <sourceDesc>
        <p>paths.colophons.25</p>
      </sourceDesc>
    </fileDesc>
  </teiHeader>
  <text>
    <body>
      <p>
ⲡ⳪︦ ⲓ(ⲏⲥⲟⲩ)ⲥ ⲡⲉⲭ(ⲣⲓⲥⲧⲟ)ⲥ ⲥⲙⲟⲩ ⲡⲙⲁⲓⲛⲟⲩϯ ⲛⲥⲁⲛ | ⲛⲧⲁⲃⲃⲓⲡⲣⲁⲩ ⲛⲡⲓⲕⲉⲫⲁⲗⲁⲓⲟⲛ ϫⲟⲙⲉ | ⲁⲃⲧⲁϥ ⲉϩⲟⲩⲛ ⲉ<placeName type="monastery" ref="paths:places:99">ⲡⲁⲣⲭⲁⲛⲅⲉⲗⲟⲥ ⲙⲓⲭⲁⲏⲗ</placeName> | ϩⲁⲡⲟⲩϫⲁⲓ ⲛⲧⲉϥⲡⲯⲏⲭⲏ ϫⲉⲕⲁⲥ ⲉⲣⲉⲡ<persName type="arch_angel">ⲁⲣ|(5)ⲭⲁⲅⲅⲉⲗⲟⲥ ⲙⲓⲭⲁⲏⲗ</persName> ϫⲓⲡⲉϩⲙⲁⲧ ⲉⲡⲛⲟⲩϯ | ϫⲟⲃ ⲉⲃⲕⲟ ⲛⲁⲃ ⲉⲃⲁⲗ ⲉⲛⲉϥⲛⲁⲃⲓ ⲛⲧⲁⲃⲁⲩ | ⲁⲩⲱ ⲉϥϣⲁⲛⲓ ⲉⲃⲁⲗ ϩⲉⲥⲟⲙⲁ ⲧⲉⲃⲉⲙⲡϣⲁ ⲛ|ⲥⲟⲇⲉⲙ ⲉⲧⲉⲥⲙⲏ ⲙⲙⲁⲕⲁⲣⲓ ⲉⲧⲉⲙⲙⲁⲩ ϫⲉⲁⲙⲟⲩ | ⲡⲉⲧⲥⲙⲁⲙⲁⲧ ⲛⲧⲉⲡⲁⲓⲱⲧ ⲁⲗⲓⲕⲗⲉⲣⲟ̣ⲙⲓⲁ | (10) ⲛⲧⲙⲉⲧⲉⲣⲁ ⲛⲧⲁⲩⲥⲉⲃⲧⲟⲥ ⲛⲉⲧⲉⲛ ⲉϫⲓⲛⲕⲁ|ⲧⲁⲃⲟⲗⲏ ⲛⲕⲟⲥⲙⲟⲥ ϩⲁⲙⲏⲛ ⲉⲥⲉϣⲟⲡⲓ | ⲇⲓⲟⲕⲗⲏϯⲓⲁⲛⲟⲩ⸱ⲭ︦ⲕ︦ⲃ︦⸱
    </p>
    </body>
  </text>
</TEI>
