<?xml version="1.0" encoding="UTF-8"?>
<?xml-model href="http://www.tei-c.org/release/xml/tei/custom/schema/relaxng/tei_ms.rng" type="application/xml"
schematypens="http://purl.oclc.org/dsdl/schematron"?>
<TEI xmlns:xsi="http://www.w3.org/2001/XMLSchema-instance"
  xsi:schemaLocation="http://www.tei-c.org/ns/1.0 ../paths-schema.xsd"
  xmlns="http://www.tei-c.org/ns/1.0">
  <teiHeader>
    <fileDesc>
      <titleStmt>
        <title>paths.colophons 197</title>
      </titleStmt>
      <publicationStmt>
        <p>paths.colophons 197</p>
      </publicationStmt>
      <sourceDesc>
        <p>paths.colophons.197</p>
      </sourceDesc>
    </fileDesc>
  </teiHeader>
  <text>
    <body>
      <p>
        ⲁⲣⲓ ⲡⲛⲁ ⲛⲙ︥ⲙⲁⲓ̈ ⲁⲣⲓⲡⲁⲙⲉⲉⲩⲉ ϫⲉⲛ̄ⲧⲉ|ⲡⲛⲟⲩⲧⲉ ⲣⲟⲉⲓⲥ ⲉⲣⲟⲓ̈ ⲛϥ̄ⲛ̄ⲧⲁϩⲁⲏ⳿ | ⲉⲃⲟⲗ ⲉⲥ̣ⲣ̄ⲁⲛⲁϥ ⲁⲛⲟⲕ ⲡϣⲟⲓ̈ ⲕⲟⲩⲓ̈ | ⲡⲓⲉⲗⲁⲭ̣ ⲁⲓ̈ⲥⲉϩ ⲡⲉⲓ̈ϫⲱⲱⲙⲉ ϩⲁⲙⲏ(ⲛ)
      </p>
    </body>
  </text>
</TEI>