<?xml version="1.0" encoding="UTF-8"?>
<?xml-model href="http://www.tei-c.org/release/xml/tei/custom/schema/relaxng/tei_ms.rng" type="application/xml"
schematypens="http://purl.oclc.org/dsdl/schematron"?>
<TEI xmlns:xsi="http://www.w3.org/2001/XMLSchema-instance"
  xsi:schemaLocation="http://www.tei-c.org/ns/1.0 ../paths-schema.xsd"
  xmlns="http://www.tei-c.org/ns/1.0">
  <teiHeader>
    <fileDesc>
      <titleStmt>
        <title>paths.colophons.102</title>
      </titleStmt>
      <publicationStmt>
        <p>paths.colophons.102</p>
      </publicationStmt>
      <sourceDesc>
        <p>paths.colophons.102</p>
      </sourceDesc>
    </fileDesc>
  </teiHeader>
  <text>
    <body>
      <p>
⳧ ϩⲙⲡⲣⲁⲛ ⲙⲡⲉⲓⲱⲧ ⲙ̣[ⲛⲡϣⲏⲣⲉ ⲙⲛⲡⲉⲡⲛ(ⲉⲩⲙ)ⲁ ⲉⲧⲟⲩⲁⲁⲃ] | ⲁⲛⲟⲕ ⲡⲓⲉⲗⲁⲭⲓⲥⲧ[ⲟⲥ ⲛ<roleName type="ecclesiastical">ⲇⲓⲁⲕⲟ]ⲛⲟⲥ</roleName> [ ± 11] | ⲛ̇ⲁⲡⲁ <persName type="donor" ref="paths.persons.135">ⲕⲟⲗⲟⲩⲑⲟⲥ</persName> · ⲡϣ[ⲏⲣ]ⲉ ⲛ̄ⲥⲭⲏⲙⲁ [ ± 9] | ⲁⲡⲓⲩⲛⲉ · ⲡ<roleName type="ecclesiastical">ⲣⲙ̄ⲛ̄ⲏⲓ̈</roleName> ⲙ̄ⲡⲉⲓⲏⲓ̈ · ⲫ · ⲙⲛ̄ⲓ̣[ ± 9] |(5)ⲭⲁⲏⲗ · ⲙⲛⲡϣⲟⲙⲧ ⲛⲥⲟⲛ ⲙⲙⲓⲥⲉ · ⲅ[± 10] | ⲙⲛ̄<persName type="donor" ref="paths.persons.136">ⲑⲉⲟⲇⲱⲣⲟⲥ</persName> ⲡⲛⲟϭ ⲙ̄<roleName type="ecclesiastical">ⲯⲁⲗⲙⲱⲇⲟⲥ</roleName> [± 9] | <roleName type="ecclesiastical">ⲇⲓⲁⲕⲟ(ⲛⲟⲥ)</roleName> ⲙⲛ̄ⲡⲁⲡⲁ <persName type="donor" ref="paths.persons.137">ϣⲉⲛⲟⲩⲧⲉ</persName> ⲙⲛ̄<persName type="donor" ref="paths.persons.138">ⲃⲓⲕⲧ[ⲱⲣ</persName> ± 7] | ⲉⲣⲉⲡⲁⲥⲟⲛ ⲛ̄ⲥⲭⲏⲙⲁ ⲡⲁⲡⲁ <persName type="monk">ⲙⲁⲣⲕⲟⲥ</persName> ⲟ ⲛ̄<roleName type="ecclesiastical">ⲣⲙ̄ⲛ̄ⲏⲓ̈</roleName> ⲉⲡⲓⲏ︦ⲓ︦ ⲫ | ⲁⲡⲉⲛⲉⲓⲱⲧ ⲙ̄ⲧⲟⲛ ⲙ̄ⲙⲟϥ · ⲁⲛⲉⲓ ⲉⲡⲉϥⲙⲁ · ⲁⲩⲱ ⲉⲓⲟ | (10) ⲙ̄ⲙⲉϩⲥⲛⲁⲩ ϩⲙ̄ⲡⲓⲏ︦ⲓ︦ · ⲁⲩⲱ ⲙ̄ⲙⲉϩϣⲟⲙⲧ̄ ⲛ<roleName type="ecclesiastical">ⲁⲣⲭⲏ|ⲇⲓⲁⲕⲟ(ⲛⲟⲥ)</roleName> ⲁⲩⲱ ⲛ̄<roleName type="ecclesiastical">ⲁⲡⲉ ϩⲛ̄ⲧⲥⲟⲟⲩϩⲥ̄</roleName> · ϩⲛ̄ⲧⲉⲓⲣⲟⲙⲡⲉ ⲧⲁⲓ | ⲥⲁⲣⲁⲕⲉⲛⲟⲥ · ⲧ︦ⲙ︦ⲋ︦ · ⲛ̄ⲧⲁⲛϩⲓⲧⲟⲟⲧⲛ̄ ⲉⲛⲉⲓϫⲱ[ⲱ]|ⲙⲉ ⲛ̄ⲗⲟⲅⲟⲥ · ⲙ̄ⲡⲉⲛⲉⲓⲱⲧ ⲁⲡⲁ <persName type="saint">ϣⲉⲛⲟⲩⲧⲉ</persName> ϫⲓ̣[ⲛ]|ⲧⲉⲩⲁⲣⲭⲏ · ϣⲁⲡⲉⲩϫⲱⲕ ⲉⲃⲟⲗ · ϩⲙ̇ⲡⲉⲥⲙⲟⲩ [ⲙⲡϫ(ⲟⲉⲓ)ⲥ | (15) ⲙⲛ̄ⲧⲃⲟⲏ̇ⲑⲓⲁ ⲙⲡⲛⲟⲩⲧⲉ · ⲙⲛ̄ⲛⲉϣⲗⲏ[ⲗ ⲛⲛⲉⲛⲉⲓⲟ]|ⲧⲉ ⲉⲧⲟⲩⲁⲁⲃ · ⲁⲛϥⲓⲡⲣⲟⲟⲩϣ · ⲛ̄[---] | ⲧⲟⲟⲧⲛ̄ · ⲁⲛⲥϩⲁⲓⲥⲟⲩ ⲉϩ[ⲟⲩⲛ ---] | ϩⲛ̄ⲧ̣[---] | [---]
verso
      </p>
    </body>
  </text>
</TEI>
