<?xml version="1.0" encoding="UTF-8"?>
<?xml-model href="http://www.tei-c.org/release/xml/tei/custom/schema/relaxng/tei_ms.rng" type="application/xml"
schematypens="http://purl.oclc.org/dsdl/schematron"?>
<TEI xmlns:xsi="http://www.w3.org/2001/XMLSchema-instance"
  xsi:schemaLocation="http://www.tei-c.org/ns/1.0 ../paths-schema.xsd"
  xmlns="http://www.tei-c.org/ns/1.0">
  <teiHeader>
    <fileDesc>
      <titleStmt>
        <title>paths.colophons.63</title>
      </titleStmt>
      <publicationStmt>
        <p>paths.colophons.63</p>
      </publicationStmt>
      <sourceDesc>
        <p>paths.colophons.63</p>
      </sourceDesc>
    </fileDesc>
  </teiHeader>
  <text>
    <body>
      <p>
ⲁⲣⲓ̄ⲡⲁⲙⲉⲉⲩ ⲛⲁⲅⲁⲡⲉ̄ ⲟⲩⲟⲛ ⲛⲓⲙ ⲉⲧⲛⲁⲱϣ ϩ̄ⲙ̄|ⲡⲓ̄ϫⲱⲱⲙⲉ⸱ⲉⲓⲥⲙⲉⲧⲁⲛⲟⲓ̄ⲁ⸱ⲕⲱ ⲛⲁⲓ̄ ⲉ̇ⲃⲟⲗ ⲛ̄|ⲛⲁϣⲟϥⲧ̄ⲥ̄⸱ⲛ̄ⲧⲁⲓϣⲱⲃⲧ̄ ⲛ̄ϩⲏⲧⲟⲩ̇⸱ϫⲉⲉⲓ̄ϫⲓⲥⲃⲱ̄ ː⸱| ⲡ⳪︦ ⲓⲥ︦ ⲡⲉⲭ̄ⲥ︦ ⲡⲉⲛⲥⲱⲧⲏⲣ⸱ⲉϥⲉⲥⲙⲟⲩ̇ ⲉ̄ⲡⲉⲛⲥⲟⲛ |(5) ⲙ̄ⲙⲁⲓ̈ⲛⲟⲩⲧⲉ⸱ⲛ<roleName type="ecclesiastical">ⲇⲓ̈ⲁⲕⲟⲛ</roleName>⸱[---] | ⲡϣⲏⲣⲉ ⲙⲡⲙⲁⲕⲁⲣⲓⲟⲥ [ ] | ⲙⲛ̄ⲛⲉϥϣⲏⲣⲉ⸱ϩ̄ⲛ̄ⲥⲙⲟⲩ ⲛⲓⲙ ⲙⲡⲛ(ⲉⲩⲙⲁⲧ)ⲓⲕⲟⲛ⸱ϫ̣ⲉ̣[ⲛ]|ⲧⲁϥϥⲉⲓ̈ⲡⲣⲟⲟⲩϣ⸱ⲙ̄ⲡⲉⲓ̄ϣⲟⲙ̄ⲛ̄ⲧ̄ ⲛ̄ⲕⲉⲫⲁⲗⲁⲓ̈ⲟⲛ | ⲛ̄ϫⲱⲱⲙⲉ⸱ⲉⲧⲉⲙ̄ⲡⲁⲣⲣⲟⲓ̄ⲙⲓ̄ⲁ⸱ⲛ̄ⲥⲟⲗⲱⲙⲟⲛ⸱|(10) ⲙⲛ̄ⲡⲉⲕⲕⲗⲉⲥⲓ̄ⲁⲥⲧⲏⲥ⸱ⲙⲛ̄ⲡϫⲱⲙⲉ ⲛ̣ⲓ̄ⲱⲃ⸱| ⲉⲧⲣⲉϥⲙⲉⲗⲉⲧⲁ ⲛ̄ϩⲏⲧⲟⲩ̇ ⲙ̄ⲛ̄ⲛⲉⲩ̣ϣⲏⲣⲉ⸱| ⲉⲩϩⲏⲩ ⲙⲛ̄ⲟⲩϫⲁⲓ̈ ⲛ̄ⲧⲉⲩⲯⲩⲭⲏ⸱ⲡ⳪︦ ⲓⲥ︦ ⲡⲉⲭ̄ⲥ︦ | ⲉ̇ϥⲉϩⲁⲣⲉϩ ⲉ̄ⲣⲱⲧⲛ̄⸱ⲛ̄ϥⲛ̄ⲧⲉⲧⲛ̣ϩⲁⲏ ⲉⲃⲟⲗ ⲕⲁⲗ̣ⲱ̣ⲥ | ⲉⲥϫⲏⲕ ⲉ̄ⲃⲟⲗ⸱ⲛϥⲣ̄ⲧⲉⲩⲧⲛ̄ ⲛⲙⲡϣⲁ ⲛ̣ⲧⲉϥ|(15)ⲥⲙⲏ ⲛ̄ⲣⲁϣⲉ⸱ⲉϥϫⲱ ⲙ̄ⲙⲟⲥ ϫⲉⲁⲙⲏⲓⲧⲛ ϣⲁⲣⲟⲓ̈ | ⲛⲉⲧⲥⲙⲁⲙⲁⲁⲧ ⲛ̄ⲧⲉⲡⲁⲓ̄ⲱⲧ⸱ⲛ̄ⲧⲉⲧⲛ̄ⲕⲗⲏⲣⲟⲛⲟ|ⲙⲉⲓ̈ ⲛ̄ⲉⲓ̄ⲁⲅⲁⲑⲟⲛ⸱ⲙⲛ̄ⲛⲉ̣ⲥ̣ⲛ̣ⲏ̣ⲩ ⲧⲏⲣⲟⲩ ⲛ̄|ⲭⲣⲓ̣ⲥϯⲁⲛⲟⲥ⸱ⲁⲙⲏⲛ⸱ⲉϥⲉϣⲱⲡⲉ
    </p>
    </body>
  </text>
</TEI>
