<?xml version="1.0" encoding="UTF-8"?>
<?xml-model href="http://www.tei-c.org/release/xml/tei/custom/schema/relaxng/tei_ms.rng" type="application/xml"
schematypens="http://purl.oclc.org/dsdl/schematron"?>
<TEI xmlns:xsi="http://www.w3.org/2001/XMLSchema-instance"
  xsi:schemaLocation="http://www.tei-c.org/ns/1.0 ../paths-schema.xsd"
  xmlns="http://www.tei-c.org/ns/1.0">
  <teiHeader>
    <fileDesc>
      <titleStmt>
        <title>paths.colophons.86</title>
      </titleStmt>
      <publicationStmt>
        <p>paths.colophons.86</p>
      </publicationStmt>
      <sourceDesc>
        <p>paths.colophons.86</p>
      </sourceDesc>
    </fileDesc>
  </teiHeader>
  <text>
    <body>
      <p>
ⲡⲟⲟⲩ ⲡⲁⲓ ⲓⲉ︦ ⲙⲡⲁⲱⲛⲉ | ϯⲣⲟⲙⲡⲉ ⲧⲁⲓ ⲭⲣ(ⲟⲛⲟⲥ) ⲙⲁⲣⲧ(ⲩⲣⲱⲛ) ⲯⲝ̄ⲑ︦ | ⲥⲁⲣⲁⲅⲉⲛⲟ(ⲛ) ⲩ︤ⲙ︦︤ⲏ︥ ⲉⲣⲉⲡⲉ|ⲭⲥ︦ ⲟ ⲛⲉⲣ̇ⲣⲟ ϩⲓϫⲱⲛ ϩⲁⲙⲏⲛ |(5) ⲁⲣⲓⲡⲁⲙⲉⲉⲩⲉ ⲛⲁⲅⲁⲡⲏ· | ⲁⲛⲟⲕ ⲡⲓⲣ̄ϥⲣ̄ⲛⲟⲃⲉ ⲙ̇ⲡ|ⲁⲣⲁⲡⲕⲁϩ· ⲧⲏⲣϥ̇· ⲡⲓ̈|ⲁⲧⲙ̇ϣⲁ ⲙ̄ⲡⲓⲣⲁⲛ ϫⲉⲇⲓ[(ⲁⲕⲟⲛⲟⲥ) | <persName type="copyist">ⲙⲣ︥ⲕⲟⲩⲣⲉ · ⲡⲩ(ⲓⲟ)ⲥ ⲙ̇ⲡ ̣[ |(10) ⲡⲁⲙⲉⲟⲥ</persName> ⲁⲣⲓⲡⲁⲙⲉⲩⲉ ⲛⲁ̣|ⲅⲁⲡⲏ · ϫⲉⲁⲛⲅ̈ⲟⲩ[ⲥⲃ|ⲟⲩⲓ· ⲙ̇ⲡⲁϯⲛⲟⲓ ⲕⲁⲗⲟ(ⲥ) [ⲁⲗ|ⲗⲁ ⲉⲓⲥϫ[ⲓ]ⲥⲃⲱ ⲛ̣̇[ |  ̣ ̣ ̣]ⲛⲁⲡ̣̣̣ | - - - - - - -

ⲡ⳪︦ ⲡⲉⲛⲧⲁϥ]ϫⲓ ⲛ̄ⲛⲉⲇ[ⲱⲣⲟⲛ ⲛ<persName type="biblical">ⲁⲃⲉⲗ</persName> ⲡⲇⲓⲕⲁⲓⲟⲥ ⲙⲛ]|[ⲧⲉⲑⲩⲥⲓ]ⲁ̣ ⲙ̇ⲡⲛ̇ⲉⲓⲱⲧ [<persName type="biblical">ⲁⲃⲣⲁϩⲁⲙ</persName> ⲙⲛⲡⲗⲉⲡⲧⲟⲛⲥⲛⲁⲩ  ̣]  ̣ ̣[ | ⲛ̣ⲧⲉ<persName type="biblical">ⲭⲏⲣⲁ</persName> · ⲛⲓⲣⲏⲛ[---<persName type="donor">]|ⲁⲗⲙⲟⲥ ⲙⲡⲉⲛⲉⲓⲱⲧ [---] |(5) ⲙ̇ⲡⲛ̇ⲙⲁⲓⲛⲟⲩⲧⲉ ⲛ[---] | ⲡⲩ(ⲓⲟ)ⲥ ⲙⲙ̇ⲁϣⲛ̇ⲕ̇ⲁ</persName> · ⲙⲛ[  ̣ ̣ ̣]ⲙⲁⲁ[ | ⲡⲁⲡⲧⲟϣ <placeName type="city_village" ref="paths:places:000">ⲡⲁⲭⲱⲣⲁⲥ</placeName> ⲛⲧⲉ<placeName type="country" ref="paths:places:000">ⲛⲟ̣ⲡⲟⲇⲓⲁ</placeName> · ϫ[ⲉⲛⲧⲟϥ] | ⲡⲛ̇ⲧⲁϥϫⲱ ⲉⲃⲟⲗ ϩⲛⲛⲉϥϩⲓⲥⲉ ⲙⲙⲓⲛ ⲙⲙⲟϥ ⲁϥⲥ|ⲙⲛ̇ⲡⲓⲕⲁⲓⲫⲁⲗⲁⲓⲟⲛ ⲛϫⲱⲱⲙⲉ · ⲁϥⲕⲁⲁϥ ϩⲛⲧⲕ̇|(10)ⲕⲗⲏⲥⲓⲁ · ⲙ̇<placeName type="church_basilica" ref="paths:places:000">ⲡ(ⲥⲧⲁⲩⲣ)ⲟⲥ</placeName> ⲙ<placeName type="city_village" ref="paths:places:000">ⲡⲧⲉⲥⲉⲣⲣⲁϩ</placeName> ϩⲁⲡⲟⲩϫⲁⲓ ⲛ̇|ⲧϥ̇ⲯⲩⲭⲏ · ⲉⲣⲉⲡⲛⲟⲩⲧⲉ ⲥⲙⲟⲩ ⲉⲣⲟϥ ϩⲛ̇ⲥ|ⲥⲙⲟⲩ ⲛⲓⲙ ⲙ̇ⲡⲛ(ⲉⲩⲙⲁⲧ)ⲓⲕⲱⲛ · ⲁⲩⲱ ⲛⲉⲡⲟⲩⲣⲁⲛⲓⲟⲛ · | ⲛⲧⲟϥ ⲙⲛ̇ⲧϥ̇ⲥϩⲓⲙⲉ ⲙⲛ̇ⲛⲉϥϣⲏⲣⲉ ⲙⲛ̇ⲉⲛⲕⲁ | ⲛⲓⲙ ⲉⲧⲛ̇ⲧϥ̇ · ⲛϥ̇ⲥϩⲁⲓ ⲉⲡϥ̇ⲣⲁⲛ ⲉⲡϫⲱⲱⲙⲉ ⲙ̇|(15)ⲡⲱⲛϩ · ⲛϥ̇ⲁⲁϥ ⲛⲙ̇ϣⲁ · ⲙ̇ⲡⲣⲁϣⲉ ⲛ̇ⲧϥ̇ⲁⲛ|ⲁⲥⲧⲁⲥⲓⲥ · ⲙⲛ̇ⲛϥ̇ⲡⲉⲧⲟⲩⲁⲁⲃ ⲧⲏⲣⲟ(ⲩ) ϩⲁⲙⲏⲛ· | ⲟⲩⲛⲁ ⲙ́ⲡⲉⲧⲥϩⲁⲓ · ⲟⲩⲥⲟⲟⲩⲛ ⲙ̇ⲡⲉⲧⲱϣ · ⲟⲩⲙⲉ|ⲧⲁⲛⲟⲓⲁ ⲙ̇ⲡⲧ̇ⲥⲱⲧⲙ̇ · ϩⲁⲙⲏⲛ ⲉⲥⲉϣⲱⲡⲉ. | ⲓ(ⲏⲥⲟ)ⲩ ⲭ(ⲣⲓⲥⲧⲟ)ⲩ ⲑ(ⲉⲟ)ⲩ ⲭⲁⲣⲓⲛ
      </p>
    </body>
  </text>
</TEI>
