<?xml version="1.0" encoding="UTF-8"?>
<?xml-model href="http://www.tei-c.org/release/xml/tei/custom/schema/relaxng/tei_ms.rng" type="application/xml"
schematypens="http://purl.oclc.org/dsdl/schematron"?>
<TEI xmlns:xsi="http://www.w3.org/2001/XMLSchema-instance"
  xsi:schemaLocation="http://www.tei-c.org/ns/1.0 ../paths-schema.xsd"
  xmlns="http://www.tei-c.org/ns/1.0">
  <teiHeader>
    <fileDesc>
      <titleStmt>
        <title>paths.colophons.17</title>
      </titleStmt>
      <publicationStmt>
        <p>paths.colophons.17</p>
      </publicationStmt>
      <sourceDesc>
        <p>paths.colophons.17</p>
      </sourceDesc>
    </fileDesc>
  </teiHeader>
  <text>
    <body>
      <p>
ⲉⲕⲱ︦ <persName type="copyist">ⲅⲁⲃⲣⲓ̈</persName> <roleName type="ecclesiastical">ⲇ(ⲓⲁ)ⲕ(ⲟⲛⲟⲥ)</roleName> | ⲉⲗⲁⲭⲓ̈ⲥⲧⲟⲩ‧ | (ⲕⲁⲓ) <persName type="copyist">ⲙⲁⲣⲕⲟⲩⲣⲉ</persName> | ⲡⲉ̣ϥϣⲏⲣⲉ‧ | (5) ⲁⲡⲱ <placeName type="city_village">ⲭⲱⲣⲓ̈ⲟⲩ ⲛ|ⲑ̣[ⲉ]ⲱⲕⲉⲛⲓ̈ⲧⲟⲥ</placeName>‧ | [ⲉⲧⲉ]ⲡⲉⲣⲡⲛⲟⲩ|[ⲧⲉ] ⲡⲉ ϩ̣ⲙ̣̄ⲡ̇ⲧⲟϣ | <placeName type="district_nomos">[ⲡⲓ]ⲟ̣ⲙ</placeName> ⲉⲕ︦ⲣ︦ⲁ︦ⲯⲁⲧ(ⲟ)? | (10) [ⲁⲡⲟ ⲇ]ⲓⲟⲕⲗⲏⲇⲓ̈|ⲁⲛⲟⲩ‧ⲭ︦ⲓ︦ⲑ︦ | ⲁⲩⲱ̇ ⲛⲧⲁⲡⲓ̈ⲁⲕⲁ|ⲑⲱⲛ ϣ̄ⲱⲡⲉ ϩⲛ̄|ⲛⲉϩⲟⲟⲩ ⲙ̇ⲡⲁⲉⲓⲱⲧ | (15) ⲡ<roleName type="ecclesiastical">ⲇⲓ̣(ⲁⲕⲟⲛⲟⲥ)</roleName> <persName type="monk">[ϩⲏⲗ]ⲓ̣ⲁ̣</persName> ⲡ<roleName type="ecclesiastical">ⲓⲕⲟ|ⲛⲟⲙ̣ⲟⲥ</roleName> ⲉ<placeName type="monastery">ⲙ̣ⲓⲭⲁⲏⲗ</placeName> | ⲉⲣⲉⲡ︦⳪︦ ⲥⲙⲟⲩ ⲉⲣⲟϥ | ⲉⲣⲉⲛⲉⲥ̇ⲙⲟⲩ ⲛⲡⲓ|ⲱⲧ ⲙⲛⲡϣⲏⲣⲉ | (20)	ⲙⲛⲡⲉⲡⲛ︦ⲁ̄ ⲉⲧⲟⲩ|ⲁⲁⲃ ‧ ⲉⲓ̈ ⲉϫⲛ̇ⲧⲁ|ⲡⲉ ⲛⲧⲛ̇ⲙⲁⲓ̈ⲛⲟⲩ|ⲧⲉ ⲛⲥⲱⲛⲉ ‧ <persName type="donor">ⲑⲁ|ⲛⲁⲥⲓ̈ⲁ ‧ ⲧϣⲛ̇ⲁ|(25)ⲛⲁⲥⲧⲁⲥⲓⲁ</persName> ‧ ϫⲉ|ⲛⲧⲟⲥ ⲁ`ⲥ´ϥⲓⲡⲣⲟ|ⲟⲩϣ ⲙⲡⲓϫⲱⲱ|ⲙⲉ ‧ ϩⲛ̄ⲛⲉⲥϩⲓ̈|ⲥⲉ ⲙ̇ⲙ̇ⲓ̈ⲛ ⲉⲙ̇ⲙⲟⲥ ‧|(30) ⲁⲥⲧⲁⲁⲃ ⲉϩⲟⲩⲛ̇ | ⲧⲉⲕⲕⲗⲏⲥ̇ⲓ̈ⲁ ⲙ̇|ⲡⲉⲥϯⲙⲉ ‧ <placeName type="monastery">ⲙⲓ̈|ⲭⲁⲏⲗ</placeName> ⲛ<placeName type="city_village">ⲥⲱ|ⲡⲉϩⲉⲥ</placeName> ‧ ϩⲁⲡⲟⲩ|(35)ϫⲁⲓ ⲛⲧⲉⲥⲯⲩⲭⲏ̇ | ϫⲉⲕⲁⲥ ⲉⲣⲉⲡⲛⲟⲩ|ⲧⲉ ⲙⲛ<persName type="arch_angel">ⲁⲣⲭⲁⲅⲅⲉ|ⲗⲟⲥ ⲙⲓ̈ⲭⲁⲏⲗ</persName> ‧ ⲥ|ⲙⲟⲩ ⲉⲣⲟⲥ ‧ ⲁⲩⲱ̇ |(40)	ⲛⲧⲉⲡⲛⲟⲩⲧ(ⲉ) ⲡⲁⲕⲁ̇|ⲑⲟⲥ ϯ ⲛⲁⲥ ⲛⲧϣⲉ|ϥⲓ̈ⲱ ⲛⲛⲉⲥⲉⲣⲏⲧ̇ | ϩⲛ̇ⲑⲓ̈ⲗ︦ⲏ︦ⲙ︦ ⲛⲧ|ⲡⲉ ‧ ϩⲁⲙⲏⲛ ⲉⲥⲉ|(45)ϣⲱⲡⲉ —
      </p>
    </body>
  </text>
</TEI>
