<?xml version="1.0" encoding="UTF-8"?>
<?xml-model href="http://www.tei-c.org/release/xml/tei/custom/schema/relaxng/tei_ms.rng" type="application/xml"
schematypens="http://purl.oclc.org/dsdl/schematron"?>
<TEI xmlns:xsi="http://www.w3.org/2001/XMLSchema-instance"
  xsi:schemaLocation="http://www.tei-c.org/ns/1.0 ../paths-schema.xsd"
  xmlns="http://www.tei-c.org/ns/1.0">
  <teiHeader>
    <fileDesc>
      <titleStmt>
        <title>paths.colophons 195</title>
      </titleStmt>
      <publicationStmt>
        <p>paths.colophons 195</p>
      </publicationStmt>
      <sourceDesc>
        <p>paths.colophons.195</p>
      </sourceDesc>
    </fileDesc>
  </teiHeader>
  <text>
    <body>
      <p>
        ⲡ⳪︦ ⲁ̇ⲣⲓⲡⲓⲛⲁⲓ ⲛⲉⲙⲡⲉⲕⲃⲱⲕ ⲡⲓⲇ︦ⲓ︦ <persName type="copyist" ref="paths.persons.215">ⲅⲁⲃⲣⲓⲏⲗ</persName> ⲕⲟⲥⲙⲏⲧ ⲁⲙⲏⲛ
      </p>
    </body>
  </text>
</TEI>