<?xml version="1.0" encoding="UTF-8"?>
<?xml-model href="http://www.tei-c.org/release/xml/tei/custom/schema/relaxng/tei_ms.rng" type="application/xml"
schematypens="http://purl.oclc.org/dsdl/schematron"?>
<TEI xmlns:xsi="http://www.w3.org/2001/XMLSchema-instance"
  xsi:schemaLocation="http://www.tei-c.org/ns/1.0 ../paths-schema.xsd"
  xmlns="http://www.tei-c.org/ns/1.0">
  <teiHeader>
    <fileDesc>
      <titleStmt>
        <title>paths.colophons 197</title>
      </titleStmt>
      <publicationStmt>
        <p>paths.colophons 197</p>
      </publicationStmt>
      <sourceDesc>
        <p>paths.colophons.197</p>
      </sourceDesc>
    </fileDesc>
  </teiHeader>
  <text>
    <body>
      <p>
        fol. 32v 
⳨ⲁⲣⲓⲡⲁⲙⲉⲩ ⲛⲁⲕⲁⲡⲓ ⲛⲁⲓⲁⲧⲉ ⲕⲗⲉⲣⲓⲕⲟⲥ ⲙⲉⲛⲉⲛ|ⲓⲁⲧⲉ ⲙⲟⲩⲛⲁːⲭⲟⲥ ⲉⲧⲛⲁⲙⲉⲗⲉ ϩⲉⲡⲓϫⲟⲙ ϣⲏⲗ | ⲉϫⲟⲓ ⲁⲛⲁⲕ ⲡⲓⲉⲃⲓⲉⲛ ⲡⲁⲣⲁⲡⲕⲁϩ ⲧⲉⲣⲃ ⲡⲇⲓⲁⲕⲟⲛⲟⲥ | ⲅⲱⲣⲅⲓ ⲡϣⲉⲣⲓ ⲛⲁⲛⲧⲣⲉⲥ ⲡⲁⲛⲁⲣⲙⲟⲩⲇⲓ⸫ | ⲡⲛⲟⲩⲧⲉ ⲁⲣⲓⲟⲩⲛⲁ ⲙⲉⲯⲓⲭⲏ ⲛⲉⲃⲓⲉⲛ ⲡⲉϩⲁⲩ | ⲡⲁϭⲓⲡϣⲓⲛⲓ ⲁⲓⲥϩⲉⲧⲛⲓⲥϩⲁⲓːⲭⲉ︦ⲭ ⲥⲟⲩⲓⲃ | ⲇⲓ̄ⲟ︦ⲕ︦ⲇⲓⲛ⸪ⲭⲓ̄︦ⲏ︦ ⲛⲉϩⲟⲩ ⲡⲁⲓⲟϯ ⲡⲇⲓⲁⲕⲟⲛⲟⲥ ϩⲓⲗⲉⲓ | ⲉⲃⲱ ⲛⲁⲣⲭⲉⲙⲁⲧⲣⲓⲧⲉⲥ ⲉⲧⲓⲉⲕⲗⲉⲥⲓⲁ S ⲡⲁⲡⲁ ⲥⲓⲥⲓⲛⲓ | ⲡⲉⲃϣⲉⲣⲓ S ⲡⲁⲡⲁ ⲡⲁⲩⲗⲉ ⲡⲟⲩⲁⲡⲟⲩⲁ ⲕⲁⲧⲁⲛⲉⲩⲣⲁⲛ
      </p>
    </body>
  </text>
</TEI>