<?xml version="1.0" encoding="UTF-8"?>
<?xml-model href="http://www.tei-c.org/release/xml/tei/custom/schema/relaxng/tei_ms.rng" type="application/xml"
schematypens="http://purl.oclc.org/dsdl/schematron"?>
<TEI xmlns:xsi="http://www.w3.org/2001/XMLSchema-instance"
  xsi:schemaLocation="http://www.tei-c.org/ns/1.0 ../paths-schema.xsd"
  xmlns="http://www.tei-c.org/ns/1.0">
  <teiHeader>
    <fileDesc>
      <titleStmt>
        <title>paths.colophons.178</title>
      </titleStmt>
      <publicationStmt>
        <p>paths.colophons.178</p>
      </publicationStmt>
      <sourceDesc>
        <p>paths.colophons.178</p>
      </sourceDesc>
    </fileDesc>
  </teiHeader>
  <text>
    <body>
      <p>
⳧ ⲓⲥ ϯⲙⲉⲇⲁⲛⲓⲁ̇ ⲱ̇ ⲛⲁⲓⲟϯ ⲉⲑⲟⲩⲁⲃ ⲟⲩⲟⲛ ⲛⲓⲃⲉⲛ | ⲉⲧⲛⲁⲱϣ ϧⲉⲛⲡⲁⲓϫⲱⲙ ⲡⲁⲓ ⲛ̇ⲧⲉⲧⲉⲛⲉⲣ|ⲡⲙⲉⲩⲓ̇ ⲛ̇ⲡⲓⲣⲉϥⲉⲣⲛⲟⲃⲓ ⲡⲁⲣⲁⲣⲱⲙⲓ ⲛⲓⲃⲉⲛ | <persName type="civil" ref="paths.persons.202">ⲥⲉⲩⲏ̇ⲣⲟⲥ ⲩ(ⲓ)ⲟ(ⲥ) ⲭⲁⲑⲁⲣⲉⲛ</persName> ϩⲟⲡⲱⲥ ⲛ̇ⲧⲉⲡⲁ|ⲟ︦ⲥ︦ ⲓ︦ⲏ︦ⲥ︦ ⲡⲭ︦ⲥ︦ ϯⲙ̇ⲧⲟⲛ ⲛ̇ⲧⲉϥϫⲟⲃⲓ ⲛ̇ⲯⲩⲭ[ⲏ] | ϧⲉⲛⲧⲉϥⲙⲉⲧⲟⲩⲣⲟ ⲛ̇ⲉⲛⲉϩ ⲁ̇ⲙⲏⲛ ⲡⲏ ⲉⲧⲛⲁ|ϫⲟⲥ ϫⲉⲁ̇ⲙⲏⲛ ⲉ̇ϥⲉϭⲓ̇ ⲕⲁⲧⲁⲡⲓⲥⲙⲟⲩ ⲁⲙⲏⲛ (ⲟⲩⲟϩ) ⲁⲙⲏⲛ
    </p>
    </body>
  </text>
</TEI>
