<?xml version="1.0" encoding="UTF-8"?>
<?xml-model href="http://www.tei-c.org/release/xml/tei/custom/schema/relaxng/tei_ms.rng" type="application/xml"
schematypens="http://purl.oclc.org/dsdl/schematron"?>
<TEI xmlns:xsi="http://www.w3.org/2001/XMLSchema-instance"
  xsi:schemaLocation="http://www.tei-c.org/ns/1.0 ../paths-schema.xsd"
  xmlns="http://www.tei-c.org/ns/1.0">
  <teiHeader>
    <fileDesc>
      <titleStmt>
        <title>paths.colophons.113</title>
      </titleStmt>
      <publicationStmt>
        <p>paths.colophons.113</p>
      </publicationStmt>
      <sourceDesc>
        <p>paths.colophons.113</p>
      </sourceDesc>
    </fileDesc>
  </teiHeader>
  <text>
    <body>
      <p>
        ⲡϫⲟⲉⲓⲥ ⲓ(ⲏⲥⲟⲩ)ⲥ ⲡⲉⲭ(ⲣⲓⲥⲧⲟ)ⲥ | ⲥⲙⲟⲩ ⲁⲩⲱ ⲛⲉⲕϩⲁ|ⲣⲉϩ ⲉⲡⲱⲛⲉϩ ⲙ|ⲡⲉⲛⲙⲁⲓⲛⲟⲩⲧⲉ ⲛ|(5)ⲥ̣ⲟ̣ⲛ <persName type="donor" ref="paths.persons.209">ⲫⲓ̣ⲃ̣ⲁ̣ⲙⲱⲛ</persName>  | ⲡ̣[± 10] | [± 3]ϩ̣ⲛ̣[± 3] | [± 1]ⲓⲛ[± 2] ⲙ̣ⲙⲟϥ | ⲁϥϥⲓ̣[± 5]ⲙ|ⲡ[±3]ϫⲱⲱⲙⲉ | ⲁϥⲥⲁϩ̣ϥ ⲁϥⲧⲁⲁϥ | ⲉϩⲟⲩⲛ ⲉⲡⲧ̣ⲟ̣ⲡⲟⲥ ⲛ|[±10] | [± 8] ⲉⲧ|(15)ϣⲟⲟⲡ̣ ϩⲙⲡⲙⲟⲛⲁ̣ⲥ̣ⲧ̣ⲏ̣|ⲣ̣ⲓ̣ⲟ̣ⲛ [ⲙⲡⲉ]ⲛ̣ⲉⲓⲱⲧ ⲁ|ⲡ̣ⲁ [± 7] ⲁ̣ⲩ̣ⲱ | [ ± 10] | ⲣ̣ⲟ̣ⲩ̣ⲛ̣[ⲁ] ⲛⲙⲙⲁ̣ϥ̣ ⲙ̣ⲡⲉϩⲟ̣ⲩ | (20) ⲙⲡⲉϥ[ϭ]ⲙ[ⲡϣⲓ]ⲛ̣ⲉ ϩⲁ|ⲙⲏⲛ | ⲉ̣ⲅ(ⲱ) <persName type="copyist" ref="paths.persons.210">ⲙⲁ̣ⲣⲕⲟⲥ̣</persName> [± 2] ⲅⲁⲗ|[ⲗⲓⲟ]ⲅⲣⲁⲫⲉ̣ⲩⲥ̣ | [ ± 10]ⲅⲉ | [ ± 12]
      </p>
    </body>
  </text>
</TEI>