<?xml version="1.0" encoding="UTF-8"?>
<?xml-model href="http://www.tei-c.org/release/xml/tei/custom/schema/relaxng/tei_ms.rng" type="application/xml"
schematypens="http://purl.oclc.org/dsdl/schematron"?>
<TEI xmlns:xsi="http://www.w3.org/2001/XMLSchema-instance"
  xsi:schemaLocation="http://www.tei-c.org/ns/1.0 ../paths-schema.xsd"
  xmlns="http://www.tei-c.org/ns/1.0">
  <teiHeader>
    <fileDesc>
      <titleStmt>
        <title>paths.colophons 197</title>
      </titleStmt>
      <publicationStmt>
        <p>paths.colophons 197</p>
      </publicationStmt>
      <sourceDesc>
        <p>paths.colophons.197</p>
      </sourceDesc>
    </fileDesc>
  </teiHeader>
  <text>
    <body>
      <p>
        fol. 120r

μνήσθυτη κ(ύρι)ε δοῦ δούλους σου ἐλαχ(ίστου) διακό(νου) | Γαβριήλ υ(ἱο)ῦ Μηνᾶ π[±3]αυ ἀπὸ χωρ(ί)ο(υ) Νιμανθωμς | συνθρόνο(υ) Θμουι (καὶ) Τκεϩλι συνχώριζον | τὸν παραπτώματα ἱμῶν ἀμήν χρόνου Μ(α)ρτ(ύρων) χϙε
      </p>
    </body>
  </text>
</TEI>