<?xml version="1.0" encoding="UTF-8"?>
<?xml-model href="http://www.tei-c.org/release/xml/tei/custom/schema/relaxng/tei_ms.rng" type="application/xml"
schematypens="http://purl.oclc.org/dsdl/schematron"?>
<TEI xmlns:xsi="http://www.w3.org/2001/XMLSchema-instance"
  xsi:schemaLocation="http://www.tei-c.org/ns/1.0 ../paths-schema.xsd"
  xmlns="http://www.tei-c.org/ns/1.0">
  <teiHeader>
    <fileDesc>
      <titleStmt>
        <title>paths.colophons.175</title>
      </titleStmt>
      <publicationStmt>
        <p>paths.colophons.175</p>
      </publicationStmt>
      <sourceDesc>
        <p>paths.colophons.175</p>
      </sourceDesc>
    </fileDesc>
  </teiHeader>
  <text>
    <body>
      <p>
ⲡⲁⲓⲗⲟⲅⲟⲥ ⲫⲁⲡⲁⲓⲱⲧ ⲡ(ⲁ)ⲡ(ⲁ) <persName type="donor" ref="paths.persons.197">ⲍⲁⲭⲁⲣⲓⲁ</persName>· (ⲟⲩⲟϩ) ⲡⲁⲥⲟⲛ <persName type="donor" ref="paths.persons.198">ⲓ̇ⲉⲣⲉⲙⲓⲁⲥ</persName> ⲡⲉϥⲥⲟⲛ (ⲟⲩⲟϩ) ⲡⲁⲥⲟⲛ <persName type="donor" ref="paths.persons.199">ⲅⲁⲩⲣⲓⲏⲗ</persName> ⲡⲟ︦ⲥ︦ ⲓ︦ⲏ︦ⲥ︦ ⲡⲭ︦ⲥ︦ ⲥⲙⲟⲩ ⲉⲣⲱⲟⲩ (ⲟⲩⲟϩ) ⲛ̔ⲧⲉϥϯⲙ̇ⲧⲟⲛ ⲛ̇ⲧⲯⲩⲭ(ⲏ) ⲉⲙⲡⲁⲓⲱⲧ ⲡ(ⲁ)ⲡ(ⲁ) ⲛⲓϫⲓ ⲡⲟⲩⲓⲱⲧ ⲁⲙⲏⲛ
    </p>
    </body>
  </text>
</TEI>
