<?xml version="1.0" encoding="UTF-8"?>
<?xml-model href="http://www.tei-c.org/release/xml/tei/custom/schema/relaxng/tei_ms.rng" type="application/xml"
schematypens="http://purl.oclc.org/dsdl/schematron"?>
<TEI xmlns:xsi="http://www.w3.org/2001/XMLSchema-instance"
  xsi:schemaLocation="http://www.tei-c.org/ns/1.0 ../paths-schema.xsd"
  xmlns="http://www.tei-c.org/ns/1.0">
  <teiHeader>
    <fileDesc>
      <titleStmt>
        <title>paths.colophons.106</title>
      </titleStmt>
      <publicationStmt>
        <p>paths.colophons.106</p>
      </publicationStmt>
      <sourceDesc>
        <p>paths.colophons.106</p>
      </sourceDesc>
    </fileDesc>
  </teiHeader>
  <text>
    <body>
      <p>
ⲡ(ϫ)ⲟ(ⲉⲓ)ⲥ ⲓ(ⲏⲥⲟⲩ)ⲥ ⲡⲉⲭ(ⲣⲓⲥⲧⲟ)ⲥ ⲥⲙⲟⲩ ⲉⲡ|ⲙⲁⲓⲛⲟⲩⲧⲉ ⲛⲥⲁⲛ ⲛ̄|ⲧⲁϥϥⲓⲡⲣⲟⲟⲩϣ ⲙ̄|ⲡⲓϫⲱⲱⲙⲉ ⲁϥⲧⲁ|(5)ⲁϥ ⲉϩⲟⲩⲛ ⲉⲡ<placeName type="monastery" ref="paths:places:99">ⲧⲟⲡⲟⲥ | ⲙ̄ⲡⲁⲣⲭⲁⲅⲅⲉⲗⲟⲥ ⲉ|ⲧⲟⲩⲁⲁⲃ ⲙⲓⲭⲁⲏⲗ ⲙ|ⲫⲁ̣ⲩ̣</placeName> ϣⲗⲏⲗ ⲉϫⲉⲙⲡⲉⲛ|ⲧⲁϥϥⲓⲡⲉϥⲣⲟⲟⲩϣ | (10) ⲛⲧⲉⲡⲛⲟⲩⲧⲉ ⲥ̄ⲙⲟⲩ ⲉ̄|ⲣⲟϥ · ⲁⲩⲱ ⲛ̇ϥϯ ⲛⲁϥ | ⲛ̄ⲧϣⲉⲃⲓⲱ̄ ⲙⲡⲉϥ|ⲉⲣⲏⲧ ϩⲛ̄ⲑⲓ(ⲉⲣⲟⲩⲥⲁ)ⲗⲏⲙ ⲛ̄ⲧ|ⲡⲉ ϩⲁⲙⲏⲛ ⲉⲥⲉϣⲱⲡⲓ̈ :-
      </p>
    </body>
  </text>
</TEI>
