<?xml version="1.0" encoding="UTF-8"?>
<?xml-model href="http://www.tei-c.org/release/xml/tei/custom/schema/relaxng/tei_ms.rng" type="application/xml"
schematypens="http://purl.oclc.org/dsdl/schematron"?>
<TEI xmlns:xsi="http://www.w3.org/2001/XMLSchema-instance"
  xsi:schemaLocation="http://www.tei-c.org/ns/1.0 ../paths-schema.xsd"
  xmlns="http://www.tei-c.org/ns/1.0">
  <teiHeader>
    <fileDesc>
      <titleStmt>
        <title>paths.colophons.70</title>
      </titleStmt>
      <publicationStmt>
        <p>paths.colophons.70</p>
      </publicationStmt>
      <sourceDesc>
        <p>paths.colophons.70</p>
      </sourceDesc>
    </fileDesc>
  </teiHeader>
  <text>
    <body>
      <p>
[ϩ]ⲙⲡⲟⲩⲱϣ ⲙⲡⲛⲟⲩⲧⲉ ⲙ̄ⲛ̄ⲛⲉϣⲗⲏⲗʾ ⲙ̄ⲡⲉⲛϫⲟⲓ̈ⲥ | [ⲛ]ⲉⲓⲱⲧʾ ⲉⲧⲟⲩⲁⲁⲃʾ ⲙ̄ⲡⲣⲟⲫⲏⲧⲏⲥ ⲡϩⲁⲅⲓⲟⲥ ⲁⲡⲁ ϣⲉ|[ⲛ]ⲟⲩⲧⲉ ⲡⲁⲣⲭⲓⲙⲁⲛⲇⲣⲓⲧⲏⲥ ⲙ̄ⲛ̄ⲧⲙ̄ⲛ̄ⲧϥⲁⲓ̈ⲣ(ⲟ)`ⲩ´ϣ | [ⲛ]ⲧⲛ̄ⲑⲉⲟⲁⲣⲏⲥⲧⲟⲥ ⲛ̄ϫⲟⲉⲓⲥ ⲙ̄ⲙⲁⲁⲩ ⲉⲧⲥⲙⲁⲙⲁⲁⲧ | (5) [ⲁⲩⲱ] ⲉⲧⲧⲁⲏⲩ ⲕⲁⲧⲁ[ⲥ]ⲙⲟⲧʾ ⲛⲓⲙʾ ⲁⲙⲙⲁ ⲙⲁⲛⲛⲟⲩ | [ⲧⲛ]ⲟϭ ⲛ̣ⲁⲣⲭⲁⲙⲁⲛⲇⲣⲓⲧⲏⲥ ⲁⲩⲱ ⲧⲁⲣⲭⲏⲅⲟⲥ | [ⲁⲩ]ⲱ ⲧϩⲩⲅⲟⲩⲙⲉⲛⲏⲥⲥⲁ · ⲙ̄ⲛ̄ⲁⲙⲁ ⲕⲩⲣⲁ ⲑⲉⲱ|[ⲇ]ⲱ̣ⲣⲁ ϣⲏⲙ ⲧⲉϣⲉⲉⲣⲉ ⲛ̄ⲧⲁⲩⲥ̄ⲙ̄ⲛ̄ⲡⲉⲓ̈ϫⲱⲱⲙⲉ | [ϩⲛ]ⲧⲉⲩⲛⲟϭ ⲙ̄ⲙⲉʾ ⲉϩⲟⲩⲛ ⲉⲡⲛⲟⲩⲧⲉʾ ⲛ̄ⲧⲁⲥⲡⲟⲩⲧⲁ|(10)[ⲍⲉ] ⲅⲁⲣ ⲁⲥⲥ̄ⲙ̄ⲛ̄ⲡⲉⲓ̈ⲛⲟϭ · ⲛ̄ⲕⲉⲫⲁⲗⲁⲓⲟⲛ ϩ̄ⲛ̄ⲧⲙⲉϩ|[ϫⲟ]ⲩⲧⲥⲛⲟⲟⲩⲥʾ ⲛ̄ⲣⲟⲙⲡⲉ ⲛ̄ⲧⲉⲥⲃⲁⲥⲓⲗⲉⲓⲁʾ ⲉⲥⲟ̄ ⲛ̄ϩⲁ|[ⲅ]ⲓⲁ ⲇⲏⲥⲡⲱⲧⲁʾ ⲉⲥⲁⲣⲭⲉⲓ ⲉϩⲣⲁⲓ̈ ⲉϫ̄ⲙ̄ⲡⲉⲥⲗⲁⲟⲥ | [ⲧ]ⲏⲣ̄ϥ ⲛ̄ⲉⲩⲗⲟⲅⲏⲙⲉⲛⲟⲥ · ⲡⲛⲟⲩⲧⲉ ⲡⲁⲓⲱⲛⲓ|[ⲟⲥ] ⲙⲁⲩⲁⲁϥʾ ⲉϥⲛⲁⲭⲁⲣⲓⲍⲉ ⲛⲁⲥ ⲛ̄ⲟⲩⲛⲟϭ ⲛ̄ⲁϩⲉʾ | (15) [ⲙⲛ]ϩⲉⲛⲣ̄ⲙ̄ⲡⲟⲟⲩⲉ ⲛⲁϣⲱⲟⲩ ⲛ̄ϥ̄ⲕⲁⲡⲉⲕⲣⲁ|[ⲧⲟ]ⲥ̣ ⲛ̄ⲁⲓⲱⲛⲓⲟⲛ, ⲁⲩⲱ ⲛ̄ⲁⲩⲧⲱⲕⲣⲁⲧⲱⲣ · | [ϩⲛ]ⲧⲉⲥⲙ̄ⲛ̄ⲧ̄ⲉⲣⲟ, ⲉϥⲧⲁϩⲏⲩ ⲉⲣⲁⲧ̄ϥ̄ ⲉϥⲙⲏⲛʾ | [ⲉ]ⲃ̣ⲟⲗʾ ϣⲁⲡⲇⲏⲗⲓⲟⲛ ⲙ̄ⲡⲕⲟⲥⲙⲟⲥ, ⲛ̄ϥ̄ⲇⲓⲟⲓ|ⲕⲉ ⲙ̄ⲡⲉⲥⲃⲓⲟⲥ ⲡⲣⲟⲥⲡⲉϥⲟⲩⲱϣ, ⲛ̄ϥ̄ϯ ⲛⲁⲥ | (20)	ⲛ̄ⲟⲩⲙⲉⲣⲓⲥ, ⲙ̄ⲛ̄ⲟⲩⲕⲗⲏⲣⲟⲥ ⲙ̄ⲛ̄ⲡⲉⲧⲟⲩ|ⲁⲁⲃʾ ⲧⲏⲣⲟⲩ · ⲛ̄ϥ̄ⲧⲣⲉⲥⲥⲱⲧ̄ⲙ̄ ⲉⲧⲉⲓ̈ⲥⲙⲏ̄ ⲙ̄ⲙⲁ|ⲕⲁⲣⲓⲟⲛ ⲉⲧⲙⲉϩʾ ⲛ̄ⲣⲁϣⲉ, ϫⲉⲁⲙⲏⲉⲓⲧ̄ⲛ̄ ⲛⲉⲧ|ⲥⲙⲁⲙⲁⲁⲧʾ ⲛ̄ⲧⲉⲡⲁⲉⲓⲧʾ ⲛ̄ⲧⲉⲧ̄ⲛ̄ⲕⲗⲏⲣⲟⲛⲟ|ⲙⲉⲓ ⲛ̄ⲧⲙ̄ⲛ̄ⲧ̄ⲉⲣⲟ ⲛ̄ⲧⲁⲩⲥ̄ⲃ̄ⲧⲱⲧ̄ⲥ̄ ⲛⲏⲧ̄ⲛ̄ | (25) ϫⲓⲛⲧⲕⲁⲧⲁⲃⲟⲗⲏ ⲙ̄ⲡⲕⲟⲥⲙⲟⲥ · ⲅⲉⲛⲉⲧⲟ | ⲅⲉⲛⲉⲧⲟʾ · ⲑⲉⲟⲩ, ⲭⲁⲣⲓⲥ; ⲛⲓⲕⲁ · ⲁⲙⲏⲛ :
    </p>
    </body>
  </text>
</TEI>
