<?xml version="1.0" encoding="UTF-8"?>
<?xml-model href="http://www.tei-c.org/release/xml/tei/custom/schema/relaxng/tei_ms.rng" type="application/xml"
schematypens="http://purl.oclc.org/dsdl/schematron"?>
<TEI xmlns:xsi="http://www.w3.org/2001/XMLSchema-instance"
  xsi:schemaLocation="http://www.tei-c.org/ns/1.0 ../paths-schema.xsd"
  xmlns="http://www.tei-c.org/ns/1.0">
  <teiHeader>
    <fileDesc>
      <titleStmt>
        <title>paths.colophons.41</title>
      </titleStmt>
      <publicationStmt>
        <p>paths.colophons.41</p>
      </publicationStmt>
      <sourceDesc>
        <p>paths.colophons.41</p>
      </sourceDesc>
    </fileDesc>
  </teiHeader>
  <text>
    <body>
      <p>
ⲉⲅⲱ ⲉⲗⲁⲭ(ⲓⲥⲧⲟⲥ) <persName type="copyist" ref="paths.persons.45">ⲙⲱⲩⲥⲏⲥ</persName> | ⲅⲁⲗⲓⲟⲅⲣⲁⲫⲟⲥ | ⲡϫⲟⲉⲓⲥ ⲓ(ⲏⲥⲟⲩ)ⲥ ⲡ(ⲉⲭⲣⲓⲥⲧⲟ)ⲥ ⲡⲉⲓⲱⲧ | ⲉⲡⲉⲛϫⲟⲉⲓⲥ ⲓ(ⲏⲥⲟⲩ)ⲥ ⲡ(ⲉⲭⲣⲓⲥⲧⲟ)ⲥ⸳ⲡⲉⲛ|(5)ⲧⲁϥϫⲓ ⲛⲛⲉⲛⲧⲱⲣⲛ | ⲛⲁⲃⲉⲗ ⲡⲇⲓⲕⲁⲓⲟⲥ⸳ⲙⲛ|ⲧⲉⲑⲉⲥⲓⲁ ⲙⲡⲉⲛⲉⲓⲱⲧ ⲁⲃ|ⲣⲁϩⲁⲙ ⲙⲛⲡⲗⲉⲡⲧⲟⲛ | ⲥⲩⲛⲁⲩ ⲛⲧⲉⲭⲏⲣⲁ ⲉϥⲉⲥ|(10)ⲙⲟⲩ ⲉⲡⲉⲛⲙⲁⲓⲛⲟⲩⲧⲉ ⲛ|ⲥⲟⲛ <persName type="donor" ref="paths.persons.87">ⲡⲁϩⲱⲙⲁ</persName> ⲙⲛⲧⲉϥ|ⲥϩⲓⲙⲉ ⲙⲉⲛⲛⲉϥϣⲏⲣⲉ | ⲙⲛⲛⲕⲁ ⲛⲓⲙ ⲉⲧϣⲟⲟⲡ | ⲛⲁϥ⸳ϫⲉⲛⲧⲟϥ ⲁϥⲃⲓⲡ|(15)ⲣⲟⲟⲩϣ ⲙⲡⲉⲓⲕⲉⲫⲁⲗⲉ|ⲟⲛ ⲛϫⲱⲱⲙⲉ ⲁϥⲥ|ⲙⲛⲧϥ ϩⲉⲛⲛⲉϥϩⲓⲥⲉ ⲙ|ⲙⲙⲓⲛ ⲉⲙⲉⲙⲙⲟⲩ⸳ⲁϥⲧⲁ|ⲁϥ ⲉϩⲟⲩⲛ ⲉⲧⲕⲟⲩⲓ ⲛ<placeName type="church_basilica" ref="paths.places.357">ⲉⲕ|(20)ⲗⲉⲥⲓⲁ⸳ⲁⲡⲁⲧⲓⲙⲟⲑⲉ ⲛⲧ|ⲙⲟⲩⲟⲩ</placeName> ϩⲁⲡⲟⲩϫⲁⲓ ⲛⲧⲉϥ|ⲯⲩⲭⲏ⸳ⲉⲣⲉⲡⲛⲟⲩⲧⲉ ⲛ|ⲛⲉϣⲗⲏⲗ ⲉⲡⲡⲉⲧⲟⲩⲁⲁⲃ | ⲡⲁⲓ ⲛⲧⲁϥⲉⲣⲡⲉⲩⲙⲉⲉⲩⲉ | (25) ⲛⲁⲥⲙⲟⲩ ⲉⲣⲟⲟⲩ ϩⲙⲡⲕⲟⲥ|ⲙⲟⲥ ⲙⲛⲛⲕⲁ ⲛⲓⲙ ⲉⲧϣⲟ|ⲟⲡ ⲛⲁϥ⸳ⲁⲩⲱ ⲟⲛ ⲉϥϣⲁⲛ|ⲉⲓ ⲉⲃⲟⲗ ϩⲉⲛⲥⲱⲙⲁ ⲛϥⲕ|ⲗⲏⲣⲟⲛⲟⲙⲓⲁ ⲛⲧⲙⲛⲧⲣⲟ ⲛ|(30)ⲛⲉⲙⲡⲏⲩⲉ ⲙⲛⲛⲉⲥⲁⲕⲁ|ⲑⲟⲛ ϩⲁⲙⲏⲛ ⲉⲥⲉϣⲱ|ⲡⲓ
    </p>
    </body>
  </text>
</TEI>
