<?xml version="1.0" encoding="UTF-8"?>
<?xml-model href="http://www.tei-c.org/release/xml/tei/custom/schema/relaxng/tei_ms.rng" type="application/xml"
schematypens="http://purl.oclc.org/dsdl/schematron"?>
<TEI xmlns:xsi="http://www.w3.org/2001/XMLSchema-instance"
  xsi:schemaLocation="http://www.tei-c.org/ns/1.0 ../paths-schema.xsd"
  xmlns="http://www.tei-c.org/ns/1.0">
  <teiHeader>
    <fileDesc>
      <titleStmt>
        <title>paths.colophons.54</title>
      </titleStmt>
      <publicationStmt>
        <p>paths.colophons.54</p>
      </publicationStmt>
      <sourceDesc>
        <p>paths.colophons.54</p>
      </sourceDesc>
    </fileDesc>
  </teiHeader>
  <text>
    <body>
      <p>
⳧ ⲡⲉⲓⲱⲧ ⲙⲛ̇ⲡ̇ϣⲏⲣⲉ ⲙⲛ̇ⲡⲉⲡⲛ̄ⲁ̄ ⲉⲧⲟⲩⲁⲁⲃ | ⲉ̇ϥⲉⲥⲙⲟⲩ ⲁⲩⲱ ⲛϥϩⲁⲣⲉϩ ⲉⲡⲱⲛϩ ⲙⲡⲉⲛ|ⲙⲟⲓ̈ⲛⲟⲩⲧ(ⲉ) ⲛ̇ϭ̄ⲥ̄ ⲛⲁⲣⲭⲉⲧⲧⲁ(ⲓⲏⲩ) ⲁⲩⲱ ⲛ̇<roleName type="religious">ⲁⲥⲕⲩⲧⲏⲥ</roleName> | ⲡⲁⲥⲟⲛ <persName type="donor">ⲕⲁⲩⲣⲓ̈ⲏⲗ</persName>⸱ϫⲉⲛⲧⲟϥ ⲁϥϥⲉⲓ̈ | (5) ⲙ̇ⲡⲣⲟⲟⲩϣ ⲙ̇ⲡⲉⲓⲕⲉⲫⲁⲗⲁⲓ̈ⲟⲛ ⲛ̇ϫⲱⲱ̇ⲙⲉ | ϩⲛ̇ⲛⲉϥϩⲓ̈ⲥⲉ ⲙ̇ⲙⲓ̈ⲛ ⲙⲙⲟϥ⸱ⲁϥⲧⲁⲁϥ ⲉϩⲟⲩⲛ | ⲉ<placeName type="monastery"></placeName>ⲡⲁⲣⲭⲁⲅⲅⲉⲗⲟⲥ ⲙⲓⲭⲁⲏⲗ</placeName> ⲉ<placeName type="city_village">ⲡϩⲁⲛⲧⲟⲟⲩ</placeName>⸱| ϩⲁⲡⲥⲱⲧⲉ ⲛ̇ⲧⲉϥⲯⲩⲭⲏ⸱ϫⲉⲕⲁⲥ ⲉ̇ⲣⲉⲡ<persName type="arch_angel">ⲁⲣⲭⲁⲅ|ⲅⲉⲗⲟⲥ ⲙⲓ̈ⲭⲁⲏⲗ</persName> ⲡⲁⲣⲁⲕⲁⲗⲉⲓ ⲙ̇ⲡⲣⲣ̇ⲟ ⲡⲉⲭ̄ⲥ̄ ⲉϩ|(10)ⲣⲁⲓ̈ ϩⲓ̈ϫⲱϥ ⲛ̇̇ϥ̇ⲕⲱ ⲛⲁϥ ⲉ̇ⲃⲟⲗ ⲛ̇ⲛⲉϥⲛⲟⲃⲉ⸱| ⲛ̇ϥ̇ϯ ⲛⲁϥ ⲛ̇ⲛⲁⲧⲡⲉ ⲛ̇ϣⲉϥⲉⲓ̈ⲱ ⲛ̇ⲛⲁⲡⲕⲁϩ ⲛⲓ̈ϣⲁⲉⲓ̈|ⲛⲉϩ ⲉⲡⲙⲁ ⲛ̇ⲛⲓ̈ⲡⲣⲟⲥⲟⲩⲟ̇ⲉⲓ̈ϣ⸱ⲁⲩⲱ̇ ⲛ̇ϥ̇ϯ ⲛⲧϣⲉⲃⲉⲓⲱ | ⲙ̇ⲡⲉⲃⲉⲣⲏⲧ ⲛⲁϥ ⲛ̇ⲣ̄ ⲛ̇ⲕⲱϥ ⲛ̇ⲥⲟⲡ ϩⲛ̇ⲑⲓⲗ̄ⲏ̄ⲙ̄ ⲉⲧⲡⲉ ⲧⲡⲟⲗ(ⲓⲥ) | ⲛ̇ⲛⲉⲛⲇⲓ̈ⲕⲁⲓ̈ⲟⲥ ⲧⲏⲣⲟⲩ⸱ⲁⲩⲱ̇ ⲉϥϣⲁⲛⲓ̈ ⲉⲃⲟⲗ ϩⲙ̇ⲡⲓⲃⲓ̈ⲟⲥ | (15) ⲛ̇ϥⲙ̇ⲡ̇ϣⲁ ⲛ̇ⲥⲱⲧⲙ̇ ⲉϯⲥⲙⲏ ⲉⲧⲙⲏϩ ⲛ̇ⲣⲁϣⲉ⸱ϩⲓ̈ⲉⲩⲫⲣⲟⲥⲩⲛⲏ | ⲛⲓ̈ⲙ ⲛ̇ⲧⲉⲡⲉⲭ̄ⲥ̄⸱ϫⲉⲁ̇ⲙⲟⲩ ⲡⲉⲧⲥⲙⲁⲙⲁⲁⲧ ⲛ̇ⲧⲏⲓ ⲁⲗⲓ̈ⲕⲗⲏⲣⲟ|ⲛⲟⲙⲉⲓ̈ ⲛ̇ⲛⲉⲓ̈ⲁⲅⲁⲑⲟⲛ ⲛ̇ⲧⲁⲓ̈ⲥⲃ̇ⲧⲱⲧⲟⲩ ⲛⲁⲕ⸱ⲉ̇ⲥⲉϣⲱⲡⲉ ⲙ̇ⲙⲟ(ⲛ) | ⲧⲏⲣ̇ⲛ⸱ⲛⲉⲧⲥϩⲁⲓ̈ ⲛⲉⲧⲱϣ⸱ⲛⲉⲧⲥⲱⲧⲙ ϩⲁⲙⲏⲛ ⲉⲥⲉϣⲱⲡⲉ | ⳧ ⲁⲩⲱ ⲁ̇ⲣⲓ̈ⲡⲙⲉⲉⲩⲉ̇ ⲙ̇ⲡⲉⲛϭ̄ⲥ̄ ⲛ̇ⲓⲱⲧ ⲙ̇ⲡⲛ(ⲉⲩⲙⲁⲧⲓⲕ)ⲟ(ⲥ) ⲕⲩⲣⲱ ⲡⲁⲉⲓⲱⲧ ⲡ<roleName type="ecclesiastical">ⲇⲓⲁⲕⲟ(ⲛⲟⲥ)</roleName> | (20) <persName type="monk">ⲓ̄ⲱ̄ⲁ̄ⲛ̄ⲛ</persName> ⲡ<roleName type="ecclesiastical">ⲁⲣⲭⲏⲙⲁⲧⲣⲓ̈ⲧⲏⲥ</roleName> ⲙ̇<placeName type="monastery" ref="paths:places:99">ⲡⲁⲣⲭⲁⲅⲅⲉⲗⲟⲥ ⲙⲓ̈ⲭⲁⲏⲗ ⲉⲡϩⲁⲛⲧⲟⲟⲩ</placeName> | ⲛ̇ⲧⲉⲡϭ̄ⲥ̄ ⲡ̇ⲛⲟⲩⲧ(ⲉ) ⲥ̇ⲙⲟⲩ ⲉ̇ⲣⲟϥ⸱ⲙⲛⲛⲉϥⲥ̇ⲛⲏⲩ⸱ⲙⲛ̇ⲛⲉϥⲣⲱⲙⲉ ⲧⲏⲣⲟⲩ | ⲛⲉⲧⲏⲡ ⲉⲣⲟϥ⸱ⲙ̇ⲛⲛⲉⲧⲛ̇ⲥⲉⲏⲡ ⲉⲣⲟϥ ⲁⲛ⸱ⲛ̇ⲧⲉⲡ̇ⲛⲟⲩϯ ϯⲟⲩⲛⲟϭ | ⲛⲟϩⲉ ⲛⲁϥ⸱ⲛ̇ϥ̇ϯⲭⲁⲣⲓ̈ⲥ ⲉ̇ⲡⲉϥϩⲟ ⲙ̇ⲡⲉⲙⲧⲟ ⲉ̇ⲃⲟⲗ⸱ⲉⲣⲱⲙⲉ ⲛⲓ̈ⲙ⸱ⲙⲛ̇ⲛⲓ̈ⲉⲝⲟⲩ|ⲥⲓⲁ ⲉⲩϫⲟⲥⲉ⸱ⲉϥⲥ̇ⲙⲟⲩ ⲉ̇ⲣⲱⲙⲉ ⲛⲓ̈ⲙ ⲉⲧϣⲟⲟⲡ ϩⲁⲧⲉϥϩⲩⲡⲟⲧⲁⲕⲏ⸱| (25) ⲛ̇ϥ̇ϫⲟⲕϥ̇ ⲉ̇ⲃⲟⲗ ϩⲉⲡⲉⲥⲭⲏⲙⲁ ⲉ̇ⲧⲟⲩⲁⲁⲃ⸱ⲛ̇ⲛⲁⲅⲅⲉⲗⲟⲥ⸱ⲛ̇ϥ̇ⲕⲱ ⲉⲃⲟⲗ | ⲛ̇ⲛⲉϥⲛⲟⲃⲉ⸱ϣⲁⲉⲛⲉϩ ϩⲁⲙⲏⲛ | ⲁⲣⲓ̈ⲡⲁⲙⲉⲉⲩⲉ ϩⲱⲱⲧ ⲛⲁⲅⲁⲡⲏ ⲟⲩⲟⲛ ⲛⲓⲙ ⲉⲧⲛⲁⲱϣ ϩⲙ̇ⲡⲓ̈ϫⲱⲱⲙⲉ ϣⲗⲏⲗ | ϩⲓ̈ϫⲱⲛ̇ ⲁⲛⲟⲕⲡⲉ <persName type="copyist">ⲓ̈ⲥⲁⲁⲕ</persName> ⲡⲉⲧⲙ̇ⲡ̇ϣⲁ ⲁⲛ ⲉⲡⲣⲁⲛ ⲉⲛⲧⲁⲩⲧⲁⲟⲩⲟϥ ⲉϩⲣⲁⲓ ⲉϫⲱϥ⸱ | ϫⲉ<roleName type="ecclesiastical">ⲡⲣ(ⲉ)ⲥ(ⲃⲩⲧⲉⲣⲟⲥ)</roleName> ⸱ⲙⲛ̇ⲡ<roleName type="ecclesiastical">ⲇⲓ(ⲁⲕⲟⲛⲟⲥ)</roleName> <persName type="copyist">ⲁⲣⲭⲏⲗⲗⲓⲧ( )</persName>⸱ⲙⲛ<persName type="copyist">ⲓ̈ⲱϩⲁⲛⲛⲏⲥ</persName> ⲕⲟⲥⲙⲓⲕⲟⲛ⸱ⲛⲉϣⲏⲣⲉ ⲙ̇ⲡ̇|(30)ⲙⲁⲕⲁⲣⲓⲟⲥ ⲡ<roleName type="ecclesiastical">ⲇⲓⲁⲕⲟ(ⲛⲟⲥ)</roleName> <persName type="monk">ⲓⲱⲥⲏⲫ</persName> ⲛⲁ<placeName type="city_village" ref="paths:places:218">ⲡⲧⲉⲡⲟⲩϩⲁⲣ</placeName> ⲉ<placeName type="district_nomos" ref="paths:places:323">ⲡⲓ̈ⲟⲙ</placeName>⸱ϣⲗⲏⲗ ϩⲓϫⲱⲛ⸱| ⲁⲩⲱ ϥⲉⲓ̈ ϩⲁⲣⲟⲛ ⲙ̇ⲛⲡⲉⲛⲕⲟⲩⲓ̈ ⲛ̇ϩⲱⲃ ⲛ̇ϭⲓϫ ⲉⲧϭⲟϫϥ ϫⲉ̣ⲙⲏⲡⲱⲧⲉ ⲉⲁⲛⲉⲛⲛⲟⲩⲥ | ϣⲱϥⲧ̇ ⲛⲟⲩⲗⲉⲝⲓⲥ ⲉⲃⲟⲗ ⲛ̇ϩⲏⲧϥ̇ ⲁⲩⲱ̇ ϫⲉⲙⲉⲁⲧϣⲱϥⲧ̇ ⲛ̇ⲥⲁⲡⲧⲉⲥ|ⲡⲱⲧⲏⲥ ⲙ̇ⲙⲁⲩⲁⲁϥ⸱ⲁⲩⲱ̇ ⲛ̇ⲧⲁⲛⲥ̇ϩⲁⲓ̈ ⲕⲁⲧⲁⲡⲁⲛϯⲓⲕⲣⲁⲫⲟⲛ ⲉⲧϩⲁ|ⲣⲟⲛ ⲁⲡⲟ ⲇⲓⲟⲕⲗⲏⲧ(ⲓⲁⲛⲟⲩ) ⲕⲁⲧⲁ ⲭⲣⲟⲛⲟⲛ ⲙⲁⲩⲧⲩⲣⲟⲛ ⲭ̄ⲑ̄ ⲥ(ⲁ)ⲣ(ⲁⲕⲏⲛⲱⲛ) ⲥ̄ⲟ̄ⲏ̄
</p>
    </body>
  </text>
</TEI>
